,id,description,title,repin_count
2,21181060741360356,"The Toppu Mini Bowl is part of the popular Toppu series. The TOPPU series consist of decorative designs in ceramic and is one of our most popular design. TOPPU was first presented in the SS17 collection, and the characteristic stripes have since been further developed into a whole series of unique products, inspired by trends of the time. Use the bowl as a decorative element or for storage. Available in several colors and sizes. The series is made of 100% ceramic and is handmade.Product Overview",Toppu Mini Bowl in Caramel / Rose,0
3,21181060741360355, ,𐀔,0
5,21181060741360352, ,constellation,1
9,21181060741360343,"Pyxis: This shimmer eyeshadow shade is named for the compass constellation, evoking the sunlit surface of seawater and bioluminescence beneath.",Celestial Sphere Gelée Eye Gloss: Pyxis,0
10,21181060741360342, ,Marshmalow flowers @inspirationbyblanca,1
11,21181060741360341,"One of a kind matte white hand-built ceramic candelabra. Fits 3 candles. Includes 3 small beeswax taper candles. 9.5"" tall, 8.25"" wide, 4.25"" deep. Handmade by Dina No in Portland, OR.",Dina No Ceramic Candelabra  No. 13,0
15,21181060741341149, ,🪞,0
17,21181060741267132,"""Playful dinner plates made from high-quality melamine, are durable and resistant to breakage, making them ideal for outdoors. Pick your favorite color or get mix of green and pink stripe set. Melamine dinner plates are perfect for picnics, lunch by the pool or enjoying your meal on the patio. (Heavy weight melamine gives the feeling of ceramics with approximate weight: 0.9lbs / 400gr per plate).   FEATURES Dishwasher safe - top rack only. BPA free. Not suitable for microwave. Durable. SPECIFICA",Melamine Vintage Style Striped Dinner Plates Set of 4pcs - High Quality heavy plastic -,0
20,21181060741267125, ,Squiggle Frame CUSTOM/ MADE to ORDER,0
22,21181060741267119,Pop art hues with handmade decoupage beads covered in gorgeous vintage prints,Lenora Dame Queen Mum Lipgloss Choker Necklace,1
48,188658671887934974,"Baby, it’s cold outside. Stay warm and look cool doing it with the ultimate coat guide from our editors. From statement pieces to oversized bombers and updated trenches, your outerwear game is ready for a refreshing overhaul.",The COAT Guide,0
49,188658671887930913,"Designer Emme Parsons makes dressing from the feet up an easy feat. Our Hero from the buzzy brand promises instant sophistication with a decidedly modern twist. You’ll love the walkable kitten heel, sleek pointed toe, and v-cut vamp—perfect for everyday and every occasion.",Emme Parsons,0
50,188658671887926198,Something to leave behind in 2023 is the stressing about what to wear—enter the best matching sets of 2024. These perfectly coordinating tops and skirts make dressing up for any winter outing a breeze.,STRIKE A MATCH,0
51,188658671887921919,"Health is wealth and if you need the motivation to recharge your wellness routine, let our latest edit inspire your next move. Incorporating daily self-care can be as simple as boosting circulation with facial tools, decrease screen time with classic board games that stimulate the mind, and break a sweat but look good doing it with cute and chic activewear.",WELLNESS BESTSELLERS,0
52,188658671887919377,"The best in beauty and skincare essentials are coming straight to your inbox with our curated edit of beloved brands and fresh products. From gua sha tools and enhancing eye masks to dewy lip glosses, we’ve got you covered.", NEW BEAUTY ARRIVALS,3
53,188658671887918878,"Baseball caps have become the new T-shirt, offering a versatile and stylish way to top off any outfit.",MIU MIU Baseball Cap ,10
54,188658671887918877,"Baseball caps have become the new T-shirt, offering a versatile and stylish way to top off any outfit.",MIU MIU Baseball Cap ,6
55,188658671887915912,"You can never have too much denim, it’s fact, so add these bestselling pieces to your personal collection for a head-to-toe update that will make you feel anything but blue. Horseshoe jeans from Citizens Of Humanity, the perfect oversized jacket from Simkhai, cool-girl bags from Jacquemus—carpe denim!",THE BESTSELLERS: DENIM Edition,16
56,188658671887909856,"Take a break from the winter wonderland and transport yourself to a far-flung destination where the sun is always shining. Our coveted edit is a paradise of wanderlust-inspiring resortwear well-suited for boat rides, walks on the beach, or lounging under the rays while sipping Aperol spritzes.",THE RESORT GUIDE,4
57,188658671887906126,"Symbolizing so much positivity—from strength and perseverance to love and friendship—January’s birthstone, the garnet, leads the New Year on a high note.",January Birthstone: THE GARNET,0
58,188658671887901591,"The cult-favorite ID series from iconic brand 3.1 Phillip Lim is back with a sophisticated new iteration our editors are obsessing over. The forecasted It Bag of 2024, our Hero is sleek and minimal yet utterly impactful. Available in multiple finishes and stylishly functional, you’ll want it in every color.",3.1 PHILLIP LIM,2
59,188658671887897637,"Start your New Year right with our edit of 24 must-haves for 2024. Meet your new wardrobe and beauty essentials: dressed-up flats you can wear from day-to-night, red lipsticks that will make you feel extra bold, dazzling hair accessories that make a big statement, and so much more.",24 MUST-HAVES for 2024,10
60,188658671887893518,NICE TO MEET YOU. Get to know SHOP BAZAAR editor Minna Shim and her fave fashion picks.,EDITOR'S PICKS,56
61,188658671887891260,"Sale season is the gift that keeps on giving well beyond the holidays—discover up to 40% off designer picks you can wear now, pack for your upcoming escapes, and then some!",SHOP BAZAAR SALE,1
62,188658671887890132,Platform Ugg boots have seen a significant resurgence. The minis are easy to pair with any look and the ideal wintertime boot for style and comfort.,Platform UGG Boots,22
63,188658671887890131,Platform Ugg boots have seen a significant resurgence. The minis are easy to pair with any look and the ideal wintertime boot for style and comfort.,Platform UGG Boots,12
64,188658671887890130,Platform Ugg boots have seen a significant resurgence. The minis are easy to pair with any look and the ideal wintertime boot for style and comfort.,Platform UGG Boots,111
65,188658671887887644,"There’s always so much to look forward to in the New Year, especially the fashion trends on our editors’ radars. From gentle peach tones that inspire warmth and kindness to perennial chunky gold earrings and fancy flats that will make each step feel like a move in the right direction, these are the 2024 must-haves you need to know and shop.",THE 2024 FASHION TRENDS,7
66,188658671887884345,"100% free from toxins, fillers, artificial colors and fragrances, and synthetic chemicals, you know exactly what you’re putting into your skin with Tata Harper’s natural skincare collection.",TATA HARPER,1
67,188658671887879710,"There’s nothing like a home update to give you a fresh perspective and outlook on life. Whatever your personality, transform your space into a physical manifestation of your 2024 mood.",FEEL at HOME,1
68,188658671887874985,"Our editors always look forward to Donni.’s next drop and this season is no exception. Be prepared to wrap yourself in the coziest vest of 2024. Crafted with a polar fleece fabric and featuring a contrasting whip stitch, our Hero is the secret to looking cool while staying absolutely warm. With deep front pockets and the brand’s signature mother of pearl buttons, this is exactly what you want to wear to start off the New Year.",HEROES,57
69,188658671887871268,Scroll through our curated edit of new styles and brands you’ll want to wear to feel like the main character you are in 2024.,2024 NEW ARRIVALS,7
70,188658671887866680,Our editors share their 2024 fashion and beauty resolutions for a style refresh everyone can appreciate.,2024 STYLE RESOLUTIONS,2
71,188658671887863299,"Laid-back is the mood for Sea, with pieces that skew toward both casual and pulled-together. Shop the New York brand's easy dresses, detailed tops, and unique prints for a look that brims with authenticity.",SEA,3
72,188658671887862438,The most stylish and comfortable pajamas for women are designed to be worn from bed to the city with effortless style!,Sleepwear Style,5
101,21181060741261453, ,Soft Jacquard Bedding Bundle - Pastel Blue / Large / Fitted,0
106,21181060741261402, ,ZIMMERMANN Embroidered Ginger Tropical Shirt,0
107,21181060741261401,"Prints that ensure a never-dull decor pattern this duvet cover and sham set cut from 300-thread-count cotton sateen for a luxurious night's sleep. Full/Queen set includes two Standard shams; King set includes two King shams 86"" x 86"" Full/Queen duvet; 20"" x 26"" shams 106"" x 92"" King duvet; 20"" x 36"" shams 300 thread count 100% cotton Machine wash, tumble dry Made in Portugal","Dusen Dusen Print Cotton Sateen Duvet Cover & Sham Set in Ivory Floral at Nordstrom, Size King",0
112,21181060741261391,"""- Handmade in USA - 23 Inch Length - 7mm - 8.5mm - 14k Yellow Gold 14mm Spring Ring Clasp - AAA Gemstones Listed Below Multi Gemstone Rainbow Necklace. Electrifying Pastels. Gorgeous genuine gemstones hand selected and color coded to create a dazzling rainbow display. Soft pastels are highlighted with pops of bright oranges, yellows and pinks. Reminiscent of a brilliant beach sunset. Rose Quartz, Pink Opal, Orange Spiney Oyster, Yellow Opal, Yellow Rutile Quartz, Citrine, Prehnite, Green Strawb","Rainbow Necklace Hand Knotted on Silk, 14k Gold Clasp",0
114,21181060741261388, ,Pink Balloon Puppy,0
115,21181060741261387,"Open up a beautiful birthday butterfly with our fun, fold-out children's birthday card featuring a butterfly with foldable wings and antennae.",Butterfly Fold Out Kids Birthday Card,0
118,21181060741261380,Faster shipping. Better service,"1pc Hanging Acrylic Magazine Display Shelves, Wall Mounted Bookshelf, Book Storage Holders, Household Storage Organizer For Office, Bedroom, Living Room, Study, Wall Decor",0
119,21181060741261379,"Our first ever Curious wall hook design is here! And of course, she's curvy! There are three hooks to securely hang a variety of items such as bags, keychains, jackets and more. Includes pre-drilled holes and screws to mount, in any orientation you prefer! Available in mustard, sage, white, lilac and pink. Want to paint your piece your own custom color? Select Primer Only from the options below. Please note this means your piece will arrive lightly sanded with a white matte primer. ✿ Overall Dim",Curiouser Wall Hook - Mustard,0
120,21181060741261377,"Tou-can light up your space with this adorable light shaped as a toucan. Emits a soft glow that’s perfect for creating a calming vibe in your space. Move the toucan's beak to adjust the direction of the light. Available exclusively at Urban Outfitters. Features Toucan-shaped table lamp Adjustable - just move the toucan's beak to change the angle of the light Plug-in; inline switch Requires E12 B type 60W bulb - not included Content + Care Acrylic, metal, wood Wipe clean Imported Made in complian",Toucan Table Lamp in Green at Urban Outfitters,1
122,21181060741261375,"Contrast is key to Simone Rocha's work: masculine and feminine, hard and soft, romantic and practical. This tiered midi dress is cut from sheer beige tulle that's embellished with green sequin florals. It has a frothy frilled hem and long straps that can be adjusted to your preferred length.",Simone Rocha - Tiered Sequin-embellished Grosgrain-trimmed Tulle Midi Dress - Neutrals - UK 8,0
136,47639708551647781,"that girl aesthetic, it girl aesthetic, motivation quotes, green aesthetic, work out quotes, manifestation quotes, dream aesthetic, consistency, heartbreak quotes, happy quotes, quotes to move on, inspirational quotes, dream aesthetic, that girl, tiktok girl, it girl, dream life, quotes, moving forward",consistency is key,0
141,47639708551647472,"Say Hello To Them: 1,000+ New Designs Launch Every Week",Elegant Summer Dresses To Try Now! 80% Off!,0
143,47639708551647470, ,oversized & chic,0
172,188658671887862437,The most stylish and comfortable pajamas for women are designed to be worn from bed to the city with effortless style!,Sleepwear Style,5
173,188658671887862436,The most stylish and comfortable pajamas for women are designed to be worn from bed to the city with effortless style!,Sleepwear Style,35
174,188658671887859670,"Holiday hair is a cinch with the resurgence of lustrous accessories. From jeweled clips to elegant bows, these sparkly pieces will take your hair to shimmering new heights!",CROWN JEWELS,7
175,188658671887856489,"With our carefully chosen selection of cherished brands and brand-new items, the greatest in skincare and beauty needs are at your fingertips.",BEAUTY,3
176,188658671887852491,"If they didn’t take the hint or you’ve been left with not-so-perfect presents, treat yourself to something on your personal wishlist with up to 40% off the gifts you really wanted. Head into the New Year with feel-good buys—you deserve it. Shop BAZAAR editors’ picks from Khaite, Balenciaga, CO Collection, By Malene Birger, and more.",SHOP BAZAAR SALE,1
177,188658671887847464,Thank you for trusting our edit and allowing SHOP BAZAAR to be a part of your journey. Wishing you and your loved ones the happiest of holidays—the best is yet to come—cheers to an even more stylish 2024!,HAPPY HOLIDAYS,0
178,188658671887844624,"When planning your warm-weather travels, turn to these lovely escapes for the chicest experience and let our edit inspire your packing list.",SUN-FILLED DESTINATIONS,0
179,188658671887841830,"Thanks to these three sustainable brands committed to responsible sourcing, artisan support, and low-impact production, making thoughtful shopping purchases is effortless. Discover your new go-to bag of 2024 you’ll feel extra good about.",DESIGNERS we LOVE,5
180,188658671887838149,"Hit the slopes with everything you need for the chicest alpine adventure. These soon-to-be bestsellers are the most shopped essentials for ski season. Explore extra warm coats, statement scarves that feel like a warm hug, designer mittens you’ll slip on every day, hydrating hand creams that will keep you protected, and more.",SKI BESTSELLERS,2
181,188658671887837751,Three red dresses that are ideal for the holidays!,Exquisite Reds,21
182,188658671887837750,Three red dresses that are ideal for the holidays!,Exquisite Reds,6
183,188658671887837749,Three red dresses that are ideal for the holidays!,Exquisite Reds,8
184,188658671887835546,"In just a few short years, Australian-brand ALÉMAIS has become one of the most anticipated brands of the industry. Collaborating with artists, each collection is a spirited escape from the mundane. Learn more about the breakout label with our exclusive interview with Creative Director Lesleigh Jermanus.",ALÉMAIS,1
185,188658671887831910,"When it comes to incredible cuisine, New York always comes out on top. These are the three new restaurants that have been the talk of the town. Get your reservations in while you can and make an entrance when you finally book a table with three standout looks styled by our editors.",WHAT’S NEW in NEW YORK,1
186,188658671887828113,Wrap yourself in cozy chic! Our new winter arrivals feature must-haves like this Loewe scarf for the perfect combination of style and warmth!,NEW ARRIVALS,12
187,188658671887827430,"Handloomed by women artisans in Oaxaca, Mexico, our exclusive Hero from sustainable brand Jaline is exactly what you want to wear when chasing the sun. Crafted from 100% cotton, this skirt features a high-rise silhouette embellished with a hand-knotted macrame fringe. In timeless black, you can go from the beach to the streets with a simple swap of accessories.",JALINE,2
188,188658671887820348,"The only way to end 2023 and start 2024 is in impeccable style. Turn to our bestsellers for all your New Year’s Eve dressing needs: sequin blazers, festive accessories, feather-accented pajamas sets, and more celebratory essentials.",NEW YEAR’S EVE DRESSING,3
189,188658671887816622,"Trends come and go, but romantic style is timeless. Inspired by the characters of The Buccaneers, this edit highlights everything we love about the storytelling and costumes of period dramas. Be prepared to be transported to another era with feminine details like lace accents, floral embroidery, and sparkling embellishments.","PAST, PRESENT & FUTURE STYLE",2
190,188658671887814608,SHOP BAZAAR Editor Jasmine Tuttle shares her style inspiration. Her go-to outfit? A bold pair of denim paired with a statement bag. Her favorite designer? Maison Margiela!,EDITOR'S PICKS,28
191,188658671887813238,Rhinestone accessories is the perfect addition to any outfit for New Years. This Alexander Wang Heiress Rhinestone Mesh Pouch will be the star of the show!,Rhinestone Bags,7
192,188658671887813237,"Feathers are a fun, flirty way to add some personality to an outfit, and they can be worn in a variety of different styles!",Feathers Accents,10
193,188658671887813236,Hair accessories make everything better. From bold ponytail holders and minimal barrettes to playful clips and more!,Bold Hair Accessories,23
194,188658671887810947,"Edgy streetwear meets refined ready-to-wear with the latest collection from French fashion house Givenchy. The brand's shoes, handbags, dresses, and separates pay close attention to detail, subverting the unexpected at every turn.",GIVENCHY,6
195,188658671887807339,"You found your dream dress, now what? Earrings. These jewels frame the face and complement the whole look, creating the perfect balance. Become the best dressed person at every formal setting you’re in with our expertly matched edit.",MEET YOUR MATCH,1
196,188658671887803152,Introducing the most fashionable gifts for everyone—with every taste—on your shopping list. Discover our latest gift guide edit inspired by our December/January issue.,HOLIDAY SPIRIT,1
199,21181060741249373, ,"Towel Bundle in 2023 | Towel, Rainbow towels, Colorful bath",0
202,21181060741249364, ,Circus Stripes Ceramic Jar with Lid - Lilac Stripe,0
203,21181060741235174, ,Little Bow Ornament - Opal,0
204,21181060741230128, ,Meadow Headpiece in Pink/Orange - Small,0
206,21181060741230122,"A Lovely Black Hearts Parisian Faux Fur Driving Coat. It’s Soft, Lightly Fuzzy And Lined. Features A Perfectly Suited Turn Down Collar. You Can Take It From Streetwear To The Perfect Evening-Wear Layered Coat. Wear Over A Black Jumpsuit, Slacks Or Any Outfit. Pair With Black Or Tan Driving Gloves In The Winter. Lena Vie Item Available Now True To Size See Sizing Slide Lined S 2/4 M 6/8 L 10 Xl 12 2x 14/16 3x 18",Lena Vie Boutique Jackets & Coats | Marseille Pari Black Hearts Faux Fur Lux Driving Midi Coat In Honey | Color: Black/Cream | Size: Various,1
207,21181060741230116,"Description This item will be made to order and takes 3-4 weeks before shipping. Headpieces with non-standard options & custom engraving cannot be returned or exchanged unless faulty. This beautiful, floral headpiece will make you feel so utterly fabulous you'll never want to take it off. A meadow scene abundant with individually hand-formed acrylic flowers in varying colours and textures. And not only is the front beautiful, the back is too - the flowers cover the whole surface of the band. Whe",Ophelia Headpiece in Pink - Not sure - please email me a size guide,1
247,47639708551627427, ,Photocircle Poster / Leinwandbild - Don't let idiots ruin your day,0
259,47639708551624592, ,billy joel vienna slow down you’re doing fine art,0
271,47639708551522525,"Taking its name from the Latin word for “extend,” the Duca candleholder does exactly that: by loosening the screw on its slender stem, the height of the design can be adjusted as the candle burns. Cast in bronzed brass and detailed with rattan enfolded around its lower half, the simple yet impactful design brings a sense of intimacy and warmth to its surroundings. A beautiful design by the Danish interior label Audo Copenhagen.",Audo Duca candle holder | By Mölle,1
272,21181060741152621, ,fun and colorful design details for future house!,1
274,21181060741129693,"Friendship bracelets, Taylor Swift, Trader Joe’s, DIY",Taylor Swift Bracelets but Make it Trader Joe’s,40
275,21181060741129669, ,Oh Joy for Casetify is Here! For iPhone and Android. Customize your size and case color!,29
280,21181060741129605,"The Deny Designs credenza features crisp mid-century modern styling with an understated Baltic Birch cabinet and sleek, curved steel Aston legs. Select from our array of curated designs to feature on the credenza doors and blend this versatile furniture staple into any decor. It can function as an office cabinet, entertainment unit or even a bar cart. It's available in either a warm, refreshingly natural finish or a premium, rich walnut veneer—allowing for a variety of design combinations. And t",Gigi Rosado Pastel Plaid Credenza Black - Deny Designs,1
281,21181060741129603,"This two-fingers ring by Scrives is composed of a large and deep aquamarine of 19.8cts (origin: Myanmar, no treatment) and of 6 sugarloaf pink spinels set on the sides (total weight: 3.65cts, origin: Myanmar). The aquamarine exhibits eye visible natural and typical inclusions. As both bands are not larges, wearing this double ring is comfortable and allows good movement of the fingers. This one-of-a-kind ring is handmade with 22kt mat finish gold. After wearing the jewellery for sometime, the go","Scrives - Spinels Double Finger 22 Karat Cocktail Ring Contemporary Aquamarine,spinel 22K Gold",1
282,21181060741129601,"Don't tell me this necklace ain't got no heart ❤️ 30"" Gold plated brass hardware 1.5"" extension Rainbow threadwork Mixed-media charms Handmade in New York City. Due to the handmade nature of our products, some charms may vary in color and style or be replaced if unavailable. Please allow 5-7 business days for production.",SHAKEDOWN STREET NECKLACE,1
292,21181060741129526, ,Checkered Towel Collection,0
295,21181060741129523, ,Salty Shadows Recline Beach Chair - Lilac,1
310,780248704183659986, ,Guest Bedroom,0
322,188658671887799672,"Inspired by croissants, these earrings from designer Jennifer Zeuner put a playful twist on French Girl style. Chunky and bold, yet designed to be lightweight, our Hero is the MVP of jewelry—wear it for every day and special occasions, and/or gift them this holiday season.",The HERO: JENNIFER ZEUNER JEWELRY,5
323,188658671887795152,"For those who have everything, you know you have to bring your A game with a gift that checks every box. Whether the recipient has plenty of coin to spare or not—our luxe gift guide features the best of the best at every price point. Special, high quality, and super chic, discover the presents you’ll want to keep for yourself.",LUXE GIFTS,2
324,188658671887791488,"When planning your cold season getaways, turn to these snow-covered destinations for a refreshing New Year reset and let our edit inspire your packing list.",Chic Escapes: ‘Tis the SKI-SEASON,2
325,188658671887789173,"Instantly recognized for their use of crystals, the optimum decadence of NY-based AREA will take your breath away. Each couture-level design is a display of quality craftsmanship, textile development, and innovative embellishment.",AREA,3
326,188658671887788729,This is the ‘it’ bag of 2023: the hobo bag was forecasted to be one of the most hyped bags as we transition into the new year!,Shop The Perfect Hobo Bag,13
327,188658671887788728,Metallic bags are the perfect outfit staple for Christmas/New Year and a great festive accessory to have!,Metallics Are Trending this Winter:,9
328,188658671887788727,This JACQUEMUS Le Bisou calf hair shoulder bag is on everyones wishlist this winter!,JACQUEMUS Essential ,12
329,188658671887785937,"It all starts with the first step—get where you need to in the New Year with our latest edit of bestsellers. Featuring the chicest heels from Amina Muaddi, quirky boots full of personality, designer sneakers for every day, and so many more alluring styles, this is the footwear selection of your dreams.",SHOE BESTSELLERS,6
330,188658671887783095,"As we wrap up 2023 and embark on 2024, we’re taking cues from our December/January cover and embracing the classics with a modern touch. Clean lines, minimal details, neutral colorways—shop timeless essentials from Chloé, Prada, Missoni, Advene, Stand Studio, and more coveted brands.",Shop The December Issue,1
331,188658671887779075,"The best in beauty and skincare essentials are coming straight to your inbox with our curated edit of beloved brands and fresh products. From gifting ideas and holiday makeup to effective tools, we’ve got you covered.",NEW Beauty ARRIVALS,2
332,188658671887775921,"We’re firm believers in ending 2023 with a bang and starting 2024 with an even bigger bang—and you can achieve it all with this Miu Miu bag on your arm. Our Hero is a prime example of why the Italian powerhouse is responsible for so many trendsetting and viral moments each season. Embracing exuberance, luxury, and all that sparkles, the iconic Wander bag is covered in crystals for a spellbinding effect. See how our editors styled it! #SHOPBAZAAR",This Miu Miu Bag Is the Most Brilliant Accessory Of The Season ,5
333,188658671887775029,An edgy leather dress is always street style approved!,Staple Leather Dress,5
334,188658671887771928,"Whatever your holiday plans, getting all dressed up is half the fun. Suiting up for the holidays is our definition of “timeless style.” Details like satin lapels, pleated tailoring, and metallic shine come together beautifully to make it one of your best looks ever.",Holiday Dressing,3
