,id,description,title,repin_count
1024,188658671887357795,"Off to the gala…or cocktail hour, or dinner with friends, or yet another wedding…whatever the occasion, dress the part. Our edit of eveningwear will inspire your next unforgettable night. Shop this dress from PatBO and more here.",Dress To The Nines With These Gowns And Cocktail Dresses,1
1025,188658671887355077,"Romantic and edgy, our Hero from Puppets And Puppets will be the night-out bag you reach for again and again. This alluring top-handle is made from butter-soft Nappa leather with a boxy silhouette and a roomy compartment for holding your essentials. Handmade and unique to each purse, the iconic rose makes every bag an exclusive. Expand your garden of accessories with these three beautiful colorways before we enter fall—and before they sell out.",Shop The Hero: The Puppets And Puppets Bag You Need On Your Arm,1
1026,188658671887354079,"A prominent brand in the quiet luxury space, Khaite is our go-to for elevated essentials. There’s a reason you see their leather pieces—namely their jackets—year after year. Move these from your wish lists to your carts before someone else does.",Shop Elevated Basics From Khaite,2
1027,188658671887349426,"We adore Bottega Veneta for their unique yet evergreen garments and accessories, especially if there’s an updated Intrecciato bag in the mix. With playful details and classic silhouettes, you’ll be obsessed with these pieces for seasons to come.",Shop Gorgeous Bottega Veneta Pieces,2
1028,188658671887345918,"A blazer is an essential part of everyone's fall wardrobe. From everyday workwear to elevated dinner attire, this chic jacket is an outfit go-to, especially in the upcoming season. Shop our editors' picks here.",Shop Sleek Blazers And Jackets For Fall,4
1029,188658671887344900,"Bring the brightness into the upcoming season with vibrant dresses, tops, trousers, and more from our edit of curated designer picks.",Go Bright Or Go Home For Fall,1
1031,188658671887339625,"Add some color to your fall wardrobe with our curated edit of luxury dresses. From fun prints to vibrant solids, it's so easy to fall in love with any of our pieces.",Shop Colorful Dresses For Fall,1
1032,188658671887337326,Invest in sheer pieces you can wear year-round.,Shop Lace Skirts From Designers You Love,0
1033,188658671887333506,A statement dress can make any day better—brighten your mood with a whole new closet with the help of our curated edit of luxury dresses.,Shop Statement Dresses For The Season,1
1034,188658671887331087,Elevate your style with ultra-chic pieces from our curated edit of new arrivals. Your fall wardrobe will thank you!,Shop Designer Picks For An Elevated Fall Style,10
1035,188658671887329977,"Hello, Canadian tuxedo. We love your new elevated look! Find denim pieces to upgrade your all-jean outfit here.",Upgrade Your Canadian Tuxedo With These Designers Jeans,2
1036,188658671887325640,"Our exclusive Hero from buzzy brand Gigi Burris is the perfect finishing touch that takes you from a day at the beach to aperitivo hour at sunset. Handcrafted in NY, the beautiful intricacy and sophistication of this straw headband is what makes it so special. Our editors love the volume it adds, the contrasting piping, and its effortless versatility—wear it with t-shirt and jeans, floral dresses, elevated workwear, and more.",Shop The Hero: Our Exclusive Headband From Gigi Burris,6
1037,188658671887323362,"It's the last full month of summer, which means it's time to start prepping your fall wish lists. Sweaters are the evergreen pieces of the season, so get a head start and shop for the coziest and chicest knits here.",Shop Colorful Knits & Cozy Sweaters At SHOP BAZAAR,1
1038,188658671887322108,Upgrade your cool fall wardrobe with designer pieces you'll love this year and the next.,Shop Fall Picks For Chic Street Style Looks,2
1039,188658671887318336,"Accessorize with pieces you'll wear again and again, from sunglasses to wide-brim hats.","Shop Luxury Accessories | Sunglasses, Scarves, Hats & More",3
1040,188658671887315620,Copenhagen Fashion Week provided some excellent street style looks for outfit inspiration. Shop our curated selection of designer clothing and luxury brands to make every week feel like fashion week.,Shop Street Style Inspired Pieces Here,4
1041,188658671887314625,"For chic picks and designer pieces, shop our edit of new arrivals, updated weekly. Find a curated selection of everything from clothing to beauty to make shopping your style a breeze.",Shop Curated New Arrivals In Beauty & Clothing,3
1051,47639708550779442, ,Outside soft landscape,0
1065,47639708550656380, ,Designer winter boots you’ll want to wear all day everyday with everything you own in your wardrobe,0
1092,21181060740601400,From our collection with @RockportShoes,Comfortable Gold Flats,0
1093,21181060740601399,From our @RockportShoes collection!,Comfortable Chic Heels,1
1098,21181060740595111,The gold dresses up and dresses down for the perfect and comfortable shoe. Shop them now! Oh Joy! x @RockportShoes,Gold Slingback Flats,1
1099,21181060740595110,"These sandals are casual and elegant, perfect for summer! From Oh Joy! x @RockportShoes",Colorblock Wedge Heels,2
1100,21181060740595108,Shop these strappy sandals @RockportShoes now! #OhJoyForRockport,Elegant Comfortable Heels,1
1101,21181060740595104,Shop these shoes from Oh Joy! x @RockportShoes now!,Pastel Strappy Heel,0
1116,21181060740559202,go to the Oh Joy! blog to see how to style this floral mini dress with our Rockport flats!,Mini Print Dress with Flats,1
1166,47639708550656372, ,Back Yard ,0
1175,47639708550561729,Brand Design | Alex Mari Photography by Kindled + Kindred | Minneapolis Brand Design Studio,Brand Design: Kindled + Kindred / Alex Mari Photography,0
1176,47639708550561728,"BALANCING OBJECTS 03 Art print by Mille Henriksen exclusively for THE POSTER CLUB. Printed on 265 g high quality art paper. Mille Henriksen is a Danish artist and graphic designer, based in Copenhagen. Unique selection of handpicked art prints and posters by Mille Henriksen and many other artists, designers and photographers — Worldwide shipping Discover more from Copenhagen based The Poster Club! #theposterclub #artprint #posterart #homedecor",New Arrivals! Explore the latest additions to our prints and poster collection for your minimal home,0
1177,47639708550561727,Timberwolf - Gray Color Palette,Arrowed Beginnings - Salt + Spruce Creative Co.,0
1180,47639708550561721,"Hylla naturen med mönstret Pampas. Den iögonfallande designen föreställer sammanflätade silhuetter och skuggformationer av bananblad, ormbunkar och gräs i tropikerna. I en palett av svart färg med gröna accenter, är denna sinnliga stil dämpad och fridfull, samtidigt som den för in naturens skönhet i hemmet. Våra tapeter är tillverkade av PVC-fria, FSC-certifierade material och har minimal miljöpåverkan i varje steg av produktionen. 180x300 cm = 4 våder 45 cm breda och 300 cm höga. Varje rulle so",House of Hackney - Tapet Pampas - Svart,0
1181,47639708550561720, ,"Brighton East 2 House in Melbourne, Australia by InForm",0
1183,47639708550561718,"Lines No 01 Art print by Little Detroit exclusively for THE POSTER CLUB. Printed on 265g high quality art paper. Unique selection of handpicked art prints and posters by Little Detroit and many other artists, designers and photographers — Worldwide shipping. Discover more from Copenhagen based The Poster Club!",Monochrome abstract wall art,0
1189,47639708550561710, ,"Es dauerte nur ein paar Jahre, bis die Trauben die Pergola bedeckten. Mein erste",9
1191,188658671887306948,Fit all you need into one large bag that also elevates your outfit. Shop purses and clutches here from our curated edit of designer bags.,Shop Large Purses & Oversized Clutches Here,5
1192,188658671887303155,Choose a look that’ll make their heads turn. A patterned blazer can make any outfit a statement—pair it with a simple base of jeans and a classic white tee to keep the jacket in the spotlight.,Patterned Looks At Copenhagen Fashion Week,3
1193,188658671887301540,"Take a break from Barbiecore pink with moody purple in the form of a monochrome, satin suit. Relax the look with chic sneakers and a simple updo with the help of an elegant hair accessory.",Shop Colorful Copenhagen Street Style Looks,4
1194,188658671887297485,"Is “elevated cowgirl” a TikTok trend yet? If you love cowboy boots and quiet luxury, this is the aesthetic for you. Shop elegant sweaters and lots of leather to get started.",Shop Copenhagen Fashion Week Street Style Inspired Looks,7
1195,188658671887295105,"Sustainably produced and handmade in NYC, our Hero from buzzy brand Jaline is the dress you’ll reach for season after season. The two-tone floral print is sophisticated and playful, while the empire waist and half-kimono sleeves promise a flattering fit and chic silhouette. Crafted from 100% silk, this elegant fabric is ideal for any end-of-summer event and the wardrobe transition into fall. Our favorite part? The plunging neckline and graceful flutter of movement with each step.","Shop This Sustainable, Made-To-Order Silk Dress",2
1196,188658671887293417,"Make a statement with your trousers, inspired by the street style looks from Copenhagen Fashion Week. Check out our edit of fun pants and playful bottoms to create your own look.",Shop Fun Trousers Here,3
1197,188658671887289282,Looking for a fun coat to prepare for fall? Shop our edit of curated jackets and coats here to find one you love.,Shop Colorful Coats And Fun Jackets For Fall,11
1198,188658671887286834,"Prepare for fall with preppy and chic knitwear—shop striped sweaters, floral cardigans, cropped vests, and more here.",Shop Sweaters And Cardigans For Fall,1
1199,188658671887285679,Take inspiration from the street style at Copenhagen Fashion Week and shop corset tops here.,Street Style From Copenhagen Fashion Week,1
1200,188658671887282039,"It may be dark and dreary in Copenhagen for Fashion Week, but we can trust the street style outfits to bring the light. Shop vibrant pieces to stand out with our edit—whether you're in Copenhagen or stateside.",Copenhagen Fashion Week Street Style,3
1201,188658671887278560,"Getting ready in the morning can be a bit monotonous, making a dress the perfect piece to base your look around. With only one garment, you're practically ready to take on the day. Shop designer dresses for brunch, work, vacation, or any other day here.",Dresses For Work And Play,9
1202,188658671887276825,"Layering in the warm and cool months is ultra-chic, and we love this look of styling a button-down under a mini dress. Shop mini dresses and more here.",Shop Chic Mini Dresses For Layering,1
1203,188658671887272232,We love a monochrome moment. Shop chic pieces to help you transition into fall here.,Shop Our Chic New Arrivals For A Seamless Fall Transition,1
1204,188658671887269377,"Shop neutral minis, printed maxis, and everything in between in our edit of designer dresses.",Shop Mini Dresses From Designers You Love,3
1205,188658671887268542,"If you prefer street style over polished and elevated looks, shop here for a wardrobe upgrade.",Shop Street Style Looks Here,0
1206,188658671887264464,"Co-founded by SHOP BAZAAR editor Jessica Rawls, it’s no wonder why we adore Alice Pearl's terry cloth pieces. Crafted from soft, organic cotton, the brand’s ‘80s-inspired playsuit is at the top of our must-have list for summer. This baby blue romper radiates laidback vibes, making it an easy, chic choice for a beach day both on and off the sand.",This Strapless Blue Romper Is Perfect For A Beach Day,0
1207,188658671887262397,"For cool, statement tops, shop our curated edit featuring brands and designers you already love and have yet to be introduced to.","Shop Cool, Statement Tops Here",5
1208,188658671887261235,"If you’re looking for a housewarming gift a bit more personal than the standard bottle of their favorite beverage, search no further. Get them something that fits their interior aesthetic that they’ll actually put out on display. Based off vintage Harper’s BAZAAR covers, scroll below to find three themed gifting collections.",What To Bring To A Housewarming Party,2
1209,188658671887257510,We adore Miu Miu—shop our curated edit from the brand here for all of your elevated wardrobe needs.,Shop Beloved Brand Miu Miu,14
1210,188658671887255203,Summery loungewear is all we're looking for at the moment—shop for yours here.,Shop Elevated Essentials And Loungewear,2
1211,188658671887254259,Elevate your going out attire with a sleek blazer and heels.,Shop Chic Blazers And Jackets ,3
1212,188658671887250328,"For a formal event or a black tie dress code, shop our edit of glamorous evening dresses.",Shop Black Tie Dresses Here,4
1213,188658671887248182,"Julia Fox does not fit into one style box. Whether it's latex or breezy cotton, we love her looks.",Julia Fox Looks Effortless In Blue Mini Shirt Dress,1
1214,188658671887247230,"For chic styles and trends you'll fall in love with, shop our edit of designer clothing. From Alaïa to Zimmermann, click here to expand your wardrobe.",Shop Designer Clothing You'll Adore,5
1215,188658671887243522,"Elevate your style with designer dresses you're bound to fall in love with. During this hot summer, these pieces will be your best friends.",Shop Elevated Designer Dresses,4
1216,188658671887239984,"Don’t let a lack of space stop you from having a good time—Cesta Collective’s handwoven Taco Tote can fit everything you could possibly need on your picnic, beach day, or wherever you find yourself this summer. The spacious carryall, like every other basket from the beloved brand, is woven from locally sourced, renewable materials and crafted by female Rwandan artisans, so you know each one was meaningfully made. The cherry on top? It comes in multiple colors.",Shop This Spacious Raffia Tote Bag,8
1217,188658671887237751,"For elevated pieces to support your chic, cool style, shop our weekly new arrivals.",Shop The Elevated Chic Aesthetic,2
1218,188658671887227574,"Finding that perfect summer dress isn't hard thanks to our curated edit of designer maxis, midis, and minis. Click here to shop for anything from slips to gowns.",Shop Colorful Summer Dresses,5
1219,188658671887225142,"Dream house, dream wardrobes—Barbiecore has been the talk of the town ever since news first broke about the live action movie. And finally, it’s here with the iconic style continuing at full speed. Channel your inner Barbie with pretty pink accessories, floral details, baby blue accents, and more.","Barbiecore Is Here: Pink Everything, Gingham Dresses, Floral Jewelry & More",3
1220,188658671887224103,"Think ruffles, peplum tops, poofy sleeves, and ludicrously capacious bags.",Three Looks That Help You Take Up Space,13
1221,188658671887219818,"Looking for a bag that can carry everything but still add a chic detail to your outfit? Check out our curated edit of luxury handbags, from top handles to totes.",Shop Chic Tote Bags Here,10
1222,188658671887217280,Loving the corset top trend? So are we—shop our curated edit of luxury corset tops and dresses to wear when you want to feel romantic.,Romantic Corset Tops & Dresses,4
1223,188658671887216338,"Explore our collection of shopping guides inspired by everything from luxury hotel stays to the Barbie movie here, and let the wardrobe expansion begin.",Shop Our Collection Of Luxury Shopping Guides,8
1224,188658671887212503,"It’s impossible to talk about the latest and greatest in beauty without mentioning award-winning Augustinus Bader. Get ready for the new season with the brand’s luxurious body cream that intensely hydrates while helping to reverse signs of aging. Inspired by 30 years of research and innovation, this rich formula promotes the appearance of firmer, toned, and more even skin. Plus, with every Hero purchase, you’ll receive a sample* from the brand. *While supplies last",Shop Hydrating Body Cream From Augustinus Bader At SHOP BAZAAR,2
1225,188658671887210210,"Fill your wardrobe with fun, playful pieces that'll catch everyone's eye as you pass. From mini dresses to knee-high boots, you'll find highly coveted picks you won't be able to forget as you scroll.",Shop Designer New Arrivals,3
1226,188658671887208363,"Looking to upgrade your designer handbag collection? From beloved vintage to trendy styles, discover shoulder bags, top handles, mini purses, and more here.",Shop Designer Handbags To Upgrade Your Collection,8
1227,188658671887204676,"Whether your style is more bohemian or business casual, discover designer skirts that'll add some flare to your wardrobe.",Shop Maxi Skirts & More Here,5
1228,188658671887202313,Going somewhere? Hit up all your fanciest RSVPs and summer events in a dress that makes you feel like royalty. Shop cocktail attire and black tie ensembles here for your wardrobe needs.,Shop Cocktail Dresses & Black Tie Gowns Here,6
1229,188658671887201489,"Love it or hate it, the Canadian tuxedo is a classic, but we think it can be done a little more modern than in the past. Shop upgraded denim pieces here to start your all jean base.",Upgrade The Canadian Tuxedo For Something More Elevated,3
1230,188658671887196059,Embrace the summer love and spend your days in romantic dresses to catch their eye. Shop lace numbers and black midis to get started.,Shop Romantic Dresses Here,14
1231,188658671887193115,"Shop designer dresses here for the summer transition into fall. From elegant midis to printed maxis, find these seasonal favorite pieces here.",Shop Elegant Dresses To Wear Into Fall,5
1232,188658671887192139,"The season may be hot, but that doesn't mean your office is. For those chilly days at work when it's sweltering outside but chilly in your cubicle, shop lightweight jackets and blazers you can easily bring with you.",Shop Lightweight Jackets For The Office,2
1233,188658671887186839,"If you're constantly gravitating towards shorts this summer, shop for some that you can easily wear to the office. From chic Bermuda to colorful and pleated to lightweight knits, shop luxury shorts here.",Shop Shorts That You Can Wear To The Office,3
1234,188658671887186838,"If you're constantly gravitating towards shorts this summer, shop for some that you can easily wear to the office. From chic Bermuda to colorful and pleated to lightweight knits, shop luxury shorts here.",Shop Shorts That You Can Wear To The Office,0
1235,188658671887184099,"With sustainability at its core, editor-favorite brand Daniella Shevel aims to provide shoes as durable as they are beautiful, and this week’s Hero is no different. The Alba Sandal is the summer slide you’ll be able to wear all day, every day—from your morning walks to your evenings out. Handcrafted in Brazil and constructed of soft, moldable jute, stacked leather, and plush memory foam, you don’t have to sacrifice comfort for style with these elegant flats.#SHOPBAZAAR",You Need These Jute Sandals For Summer,4
1236,188658671887182737,"Don't know what to wear to brunch? Find some elevated basics here that you can easily mix and match with any bottoms, no matter where you're headed.",Shop Elevated Summer Basics,4
1237,188658671887179469,Head to the office in something professional yet chic with our edit of designer dresses that will help you get through the summer months.,Shop Professional And Stylish Work Dresses,2
1238,188658671887177166,"Mini dresses are easy pieces to throw on in the summer heat, plus they're perfect for transitioning from day to night.",Shop Stunning Mini Dresses At SHOP BAZAAR,3
1239,188658671887176048,"Heavy patterns and prints on summer clothes are the ultra-chic looks you'll want as we get deeper into this warm season. They're so striking, and ultimately make you look like a walking statement piece.",Shop Here For Large Summer Prints,0
1240,188658671887172663,"Summer doesn't always call for brights—muted colors with vibrant accents are beautiful picks for the season. Shop designer jumpsuits, silk scarves, high heels, and more here.",You Need These Colorful Picks For Summer,1
1269,47639708550561683,"Våra moderna fritidshus har vackra proportioner och detaljer som håller över tiden. Det betyder enkla former, enhetliga material och lugn fönstersättning. Byggnaderna smälter in i landskapet istället för att konkurrera med det. Obrutna glaspartier ger närkontakt med tomten. Stora uteplatser gör det lätt att vistas utomhus.",Moderna fritidshus av högsta kvalitet,1
1285,47639708550327735, ,Fonts - Kerrie Legend,34
1314,21181060740559198,go to the Oh Joy! blog to see how to style this daisy jeans with our Rockport flats!,Daisy Jeans with Flats,8
1315,21181060740559092,go to the Oh Joy! blog to see how to style this daisy jeans with our Rockport flats!,Daisy Jeans with Flats,9
1316,21181060740559088,go to the Oh Joy! blog to see how to style this striped shirt with our Rockport flats!,Striped Shirt with Flats,3
1317,21181060740559084,go to the Oh Joy! blog to see how to style this striped shirt with our Rockport flats!,Striped Shirt with Flats,5
1318,21181060740559081,go to the Oh Joy! blog to see how to style this striped shirt with our Rockport flats!,Striped Shirt with Flats,3
1319,21181060740559062,go to the Oh Joy! blog to see how to style this jumpsuit with our Rockport flats!,Jumpsuit with Flats,4
1320,21181060740559060,go to the Oh Joy! blog to see how to style this jumpsuit with our Rockport flats!,Jumpsuit and Flats,5
1321,21181060740559057,perfect for dinner out!,Strappy Heels,0
1322,21181060740559056,perfect for the theater,Gold Flats,2
1323,21181060740559053,perfect for plant shopping!,Colorblock Wedges,6
1331,21181060740496836, ,Handmade Ceramics Mug ORANGE MARBLE || Ceramic Coffee Mug || Stoneware Ceramics Cup || Turmeric Mug || Ceramic Tea Cup,3
1332,21181060740496833, ,"Jumbo Decorative Marble Scallop Bowl , Ruffled Marble Bowl, Flower Bowl , Fruit Bowl , Birthday Gift",2
1344,47639708550274947,"Upptäck all vår senaste köksinspiration, vare sig du söker ett klassiskt lantkök i shaker-stil, vackra träkök eller våra moderna designkök kan vi hjälpa dig. Leverans inom 8 veckor. Läs mer om oss på www.nordiskakok.se",Upptäck våra shakerkök,0
1353,47639708550272445, ,Skall Christmas Card No. 2 -  Patricia Perales Garcia,0
1390,21181060740496822, ,Remix it Knit Short - Jungle - Jungle / S - M,2
1391,21181060740496821, ,Experimental Typography,12
1393,21181060740496818, ,Diamond & Birthstone Confetti Personalised 9ct Gold Wedding Ring  | handmade | gift for women | for her | wedding band,1
1396,21181060740464411,Dort - tenis,Dorty - Cake,4
1399,21181060740464398,"Add a glam lighting option to your living room or dining room with the 7.25"" H Gracieleigh retro globe shade pendant light from Joss & Main. Showcasing a brushed gold-finish round base and an on-trend-colored glass globe shade, this hanging pendant is a true standout piece. It requires one 40-watt E26 bulb (not included) and is also LED compatible. A great pairing with both modern and retro-style decor, it also features an adjustable hanging wire so you can alter the drop height from 10 to 58 in","Joss & Main Gracieleigh 1 - Light Unique Globe Pendant Glass in Pink, Size 7.25 H x 8.0 W x 8.0 D in | Wayfair",6
1400,21181060740451392,Every Friday we post some fun links from around the web. Check it out!,Weekend Links on Oh Joy! Blog,3
1401,21181060740451385,Every Friday we post some fun links from around the web. Check it out!,Weekend Links on Oh Joy! Blog,0
1402,21181060740450371,Shop them here! Pair them with fun pastel check pants this spring.,#OhJoyForRockport Gold Slingback Flats,5
1403,21181060740450368,Wear these amazing pants with our #OhJoyForRockport gold flat slingbacks,Large Pink Check Pants for Gold Slingbacks,8
1404,21181060740450367,Pairs wonderfully with our gold #OhJoyForRockport flats,Pink Plaid Pants for Gold Flats,4
1405,21181060740450366,Pair with our #OhJoyForRockport gold slingback flats!,Pink Check Pants Perfect for Gold Flats,3
1407,21181060740448256,Read all my tips on the blog,Traveling to Tokyo with Kids,4
1408,21181060740447848,"Shop the entire collection, made by women for women.",The Oh Joy! for Rockport Collection is here!,26
1409,21181060740447634,Keep it fun with this short jumpsuit and match with our #OhJoyForRockport wedges,Short Jumpsuit for Wedges,10
1410,21181060740447533,Pair with our #OhJoyForRockport wedges,Floral Jumpsuit for Wedge Heels,5
1411,21181060740447532,The perfect floral jumpsuit for our #OhJoyForRockport wedge sandals.,Floral Jumpsuit for Wedge Sandals,3
1412,21181060740447531,Perfect this spring with floral jumpsuits and rompers! Shop now!,#OhJoyForRockport Wedge Sandal,6
1413,21181060740447530,Pair our #OhJoyForRockport wedges with this fun floral jumpsuit this spring,Spring Floral Jumpsuit Perfect for Wedges,1
1414,188658671887170379,Who doesn't love a mini skirt? One of our editor-favorite styles for the hot months are these ultra-chic bottoms. Shop designer picks here.,Ulta-Mini Mini Skirts For Summer,3
1415,188658671887169263,"No matter your aesthetic, find new luxury pieces for your wardrobe at SHOP BAZAAR. Every week, discover designer new arrivals you'll fall in love with and never want to take off.",Shop Stunning New Arrivals For Summer,2
1416,188658671887166529,Life is too short to settle for drab suiting—check out our curated collection of vibrant workwear you'll want to style in and out of the office.,Colorful Summer Suiting For The Fashion Lover Of The Office,1
1417,188658671887164344,"There's nothing better in the summer than a romantic midi dress and a bright purse. Check out our curated selection of designer dresses here, and find your latest outfit fixation.",Romantic & Chic Midi Dresses For Summer,6
