,id,description,title,repin_count
3353,188658671886105163,"There's no question: a trench coat is a fashion classic, and for good reason. The timeless garment is clean, elegant, and elevates any look, no matter what's underneath. It's a statement piece that doesn't need to be heavily patterned or vibrant colored in order to grab attention. Shop our favorite trench coats here.",The Timeless Trench: Our Top 9 Trench Coats You Need to Check Out Now,4
3354,188658671886104382,"There’s nothing more classic than a trench coat in autumn. Your chic style deserves to be on display, not hidden when the cool weather comes rolling in—this luxe outerwear perfectly bridges the gap between keeping you warm and keeping you fashionable for everyone to admire. Shop our editors’ picks below: two-tone pieces from Sacai, ruffle details from Chloé, silk trenches from Saint Laurent, smooth leather from Magda Butrym, and more.",9 Elevated Trench Coats for Your Fall Rotation,8
3355,188658671886102085,"It's the season of the boot, and our editors at ShopBAZAAR are loving every style, fit, and height for fall. Shop python knee-highs, platform neutrals, fishnet pumps, patent combats, and so much more.",Every Boot You Could Dream of at Your Fingertips,2
3356,188658671886100867,"Looking for fun ways to layer? Start with a dress and add a pair of pants underneath. We know it may bring you back to early 2000s red carpets (it does for us, anyway), but this is a layerable look that can be elevated for an older audience.",Dresses You Can Layer With,4
3357,188658671886099874,"As lovers of large prints, we love it when a focal point of our look is covered in a wild pattern. Make a statement with your outfit and center it around a pair of pants coated in leopard, camo, floral, stripes, and more.",Slither Into Our Edit of Luxe Pants to Complete Your Fall Outfits,2
3358,188658671886097327,"If you love the versatility of a denim jacket and the elevated polish of a trench, our Hero from @diesel is the ultimate must-have. The coat is the season's It piece and part of the brand's Diesel Library collection. Featuring a double-breasted shank bottom closure, dramatic midi-length, classic storm flap, functional cuff tabs, and silhouette-defining buckled belt, this is a showstopping piece perfect for layering over jeans or pants.",You Need This Deliriously Good ShopBAZAAR Hero from Diesel,14
3359,188658671886096710,Drew Barrymore is our suiting inspiration with her simple navy blazer and trousers paired with platform heels. We're loving this busy bee look on her.,Drew Barrymore is So Chic in This Navy Suit,1
3360,188658671886096144,"Leave the house feeling like you're wrapped in your favorite blanket with your choice of designer coats at your fingertips. Our bundle of outerwear will get you through fall and into winter while staying warm and remaining chic, whether you're more puffer or trench. Don't wait too long, though, or your most desired styles will be gone! 🧥","Puffers, Trench Coats, Wraps—Oh, My! Shop Designer Coats to Keep You Warm and Enhance Your Style",13
3361,188658671886092995,"Often overlooked when choosing closet favorites, your choice of bottoms can (and should) be the center of your whole outfit with the right pair. Shop statement trousers, jeans, flares, culottes, and more here.",What Does Your Choice of Pants Say About You? Shop Designer Pairs Now!,2
3362,188658671886092210,"One thing everyone needs in their closet? A leather jacket. Warm, chic, and sturdy, leather outerwear can make or break an outfit—and they're perfect to throw on when you're trying to make a casual look a little more elevated.",10+ Leather Jackets You Need to Shop Now,3
3363,188658671886090042,"Welcome to our 2022 Gift BAZAAR! As always, our editors present only the best of the best so you can solidify ""best gift giver"" status. From incredible exclusives you won't find anywhere else to coveted picks from the buzziest brands, this is your one-stop shop for everyone on your list.","Find Your Holiday Gifts Here! Designer Fashion, Maximalist Home Decor, Elegant Jewelry, and More!",0
3364,188658671886089255,"Victoria Beckham has always been a fashion icon, but this green dress and simple black-toed heels remind us just how stylish she really is.",Victoria Beckham's Beautiful Fall Outfit Has Us Green With Envy,3
3365,188658671886088313,"For your fall fashion upgrades, scroll through our edit of decadent designer clothing and find what speaks to you. Whether you're more minimalist, maximalist, or don't define your style, our edit will have something that makes you add to cart immediately.",Shop Coveted Clothing and Piece Together a Stunning Fall Outfit,7
3366,188658671886086047,"Expand your options for your fall outfits with designer coats, chic sunglasses, and oh-so-cozy sweaters that will last your a lifetime thanks to their beautiful construction and timeless designs. Shop Isabel Marant, The Vampire's Wife, Alanui, The Row, and more.",Coveted Clothes You'll Never Want to Take Off,10
3367,188658671886085530,"Throwing a dinner party? Don't let your tablescape fall flat—impress your guests with artisanal tableware and a candlelit glow to accompany your meal. Amanda Lindroth's rattan-wrapped glassware and ruffle-edged plates will never fail to earn compliments, ensuring that your spread looks as good as it tastes.",Dress Your Table to Impress With This Beautiful Homeware,2
3368,188658671886084597,"Consider this your formal invitation to party season. ✨💃 Whatever holiday soirée or winter wedding you're going to, you'll stand out from the crowd with our selection of luxe, festive dresses: sultry cut-outs, ruffled tiers, sequin-drenched minis, and more for their viewing pleasure.",Shop Formal Dresses For a Stunning Holiday Season,3
3369,188658671886081296,"Our menu this evening features delectable vibrant sweaters, ruffle micro skirts, sultry beauty, and enchanting jewelry so your closet is never hungry. Satiate your style appetite with our new fall arrivals here.",Shop These Designer Pieces For a Stunning Fall Outfit,4
3370,188658671886080167,"Someone get Taylor Swift on the phone—it's the season of the cardigan. As if we needed another reason to love fall, the endless versatility and warm comfort of the chic knit makes dressing for this cool time so much less of a chore and more of a fashion show within our bedroom walls. Shop 20 of our most sought-after cardis for a cozy autumn ahead.",20 Cardigans You Won't See In Your Grandmother's Closet,1
3371,188658671886078898,"Looking for a statement coat? Our editors searched for you. Whether you're wanting a bold pattern or a vivid color, these head-turning jackets will define your fall fashion.",Complete Your Fall Outfits with a Statement Coat,5
3372,188658671886076395,"Express your stylish self without compromising your comfort this fall with oh-so-chic jackets and blazers. Shop from designers you love for the most fashionable layers: Khaite, Nili Lotan, Forte Forte, and more.",Stay Warm This Fall with Stylish Blazers and Jackets from Designer Brands,1
3373,188658671886075583,"Diamonds may be a girl’s best friend, but shoes are definitely part of the inner circle. This fall, complete your footwear collection with the best and brightest shoe trends we’ve been seeing everywhere: twinkle toes, penny loafers, new height platforms, weather-proof boots, and a clog comeback. #linkinbio",The Must-Buy Shoe Trends of 2022,3
3374,188658671886074241,"Nothing says ""laidback and cool"" like a little top and baggy pants. Shop loose trousers, oversized jackets, chic crop tops, trendy bags, and more in our new arrivals edit.",Must-Have New Arrivals to Upgrade Your Fall Outfits,6
3375,188658671886071664,"Arrive to your holiday parties and seasonal events in a dress that will surely turn heads. Our ShopBAZAAR editors adore an eye-catching look, and this edit will definitely help you craft the outfit you're going for.",What to Wear to Those Upcoming Holiday Parties,4
3376,188658671886070534,"Be daring this fall with pieces you normally might not try out during the season. Sheer dresses, crocheted skirts, feathers on feathers—try something new and take on fall with a newfound confidence.",Shop Must-Have Clothing on ShopBAZAAR,7
3377,188658671886069750,"For a feminine and oh-so-pink look, Miu Miu is the brand for you. Our editors adore this powder pink Miu Wander bag so much, they had to add it to our site! Shop more desirable Miu Miu pieces here!",Miu Miu is a Forever Editor-Fave Brand,9
3387,21181060739518285, ,Dazed Beauty | Dazed Beauty,6
3396,21181060739486504,from @cb2,Descanso Bowl,5
3397,21181060739486498,from @cb2,Descanso Tray,5
3398,21181060739486495,from @cb2,Strand Brass Table Lamp,3
3399,21181060739486478,from @cb2,Half Moon Ivory Velvet Dining Chair,15
3400,21181060739486472,from @cb2,El Verano Travertine Side Table,6
3402,21181060739463432, ,Reva skincare brand and packaging design by MindMuse,8
3477,188658671886067524,"Make a statement with a head-turning dress. Enjoy designer pieces from BLUMARINE, Valentino, PatBo, Khaite, and more for an upgrade to your dress collection.",Shop Beautiful Dresses and Gorgeous Gowns with ShopBAZAAR's Dress Edit,3
3478,188658671886066235,"If you live in a climate where you experience all four seasons, you need a coat that will keep you warm but still reflect your style. Shop our edit of must-have jackets, coats, blazers, and more for a truly fashionable fall and winter.",Shop These Winter Coats Before It's Too Cold Outside,4
3479,188658671886065092,"While the layers upon layers that come with the cold weather may hide away your carefully curated looks, don’t let that stop you from flaunting your style with a new winter it-bag. Whether you’re headed to a holiday party or simply running to the store, make sure you’re carrying a piece that turns heads—shop these trends for the season: a rainbow of color, party petites, mesmerizing metallics, soft textures, and slouchy silhouettes.",20 It-Bags You'll Adore For Winter,6
3480,188658671886061626,Victoria Beckham looks absolutely radiant in this white midi dress. We love how she paired chic red heels with the minimalist look.,Shop Victoria Beckham at ShopBAZAAR,2
3481,188658671886060409,"Head into work with all eyes on you—and not just because you strolled in late with a large iced coffee in hand. Your work attire should reflect your style, and our suiting edit really captures the personality of any corporate chic figure. Shop blazers from Jacquemus, pink sets from Patou, velvet trousers from Jil Sander, and more.",Shop Suiting That Reflects Your Style,4
3482,188658671886058002,"We're loving a statement skirt moment for the season, and our editors at ShopBAZAAR have refreshed our skirt edit to feature all the lengths, styles, and colors you could imagine!",Shop For Statement Skirts to Upgrade Your Fall Outfits,3
3483,188658671886056875,"We can't help it—even in the cold months, we love to wear our mini skirts and short dresses. Thankfully, we can go out without freezing our legs off with chic tights and cozy socks to layer up. Shop our printed tights here!",You Need These Tights for the Cool Days You Still Want to Throw On a Mini Skirt,5
3484,188658671886056350,"Loafers, skirts, sunglasses—oh, my! Wanting to upgrade your fall wardrobe and refresh your outfit rotation? Look no further: our edit of new arrivals features all the styles you love for the season from designers you adore. Shop Prada purses, Samsoe Samsoe striped sweaters, Marni skirts, Labucq boots, and so much more.",Shop Our New Arrivals for a Chic Fall Outfit,3
3485,188658671886054020,"Our coveted selection of new arrivals has everything you could dream of: chic printed coats, highly-desired dresses, metallic heels, luxe beauty, and so much more. Shop them now—and maybe get a head start on holiday shopping!",Shop Must-Have New Arrivals on ShopBAZAAR,5
3486,188658671886053522,"Looking for a statement coat? Our editors searched for you. Whether you're wanting a bold pattern or a vivid color, these head-turning jackets will define your fall fashion.","Shop Statement Jackets, Printed Coats, and Chic Blazers to Prepare for the Cold",7
3487,188658671886052976,"What better excuse to redecorate your home than the fact that it's cozy season? Fall is a time for soft blankets, warm hues, moody candles, and plush rugs—anything to make the cooling temps a bit more bearable. Shop luxe home decor here and you'll never want to escape your sanctuary.",Shop Warm and Cozy Home Decor,1
3488,188658671886049435,"Bells are ringing, doves are flying, toasts are being given—fall wedding season is officially upon us. An impeccable shoe isn't a want but a need when it comes to wedding planning, and Loeffler Randall's timeless sandals are ones you'll never get tired of looking at when going through your wedding photos.",The Fall Wedding Shoes and Accessories You'll Fall in Love With,1
3489,188658671886048802,"The opal is an iridescent stone that is believed to enhance positivity and inspire creativity in the wearer. Even if you don’t have an October birthday, this breathtaking gem is a jewelry must-have.",Opal: The October Birthstone You'll Want to Add to Your Jewelry Box Now,4
3490,188658671886048671, ,Take Halloween Inspiration From These Obsess-Worthy Movies & TV Shows,18
3491,188658671886048358,"Workwear isn’t just for the office, take suiting off-duty this fall with stripes from Jacquemus, strong shoulders, waistcoat chicness, and more.",Shop This Suiting for a Professional and Chic Fall Wardrobe,0
3492,188658671886045942,"Though the time to bare arms may be in the near past and distant future, this is the season to embrace layering. A dress without sleeves isn't one we're passing up on when there are so many chic sweaters and cardigans we can throw on for an even more interesting look.",You Need to Shop These Dresses for Chic Fall Outfits,18
3493,188658671886045082,"Naomi Campbell is a shining light in this simply stunning silver coat and sports sunglasses. We love a statement piece, and this trench does the trick. Shop eye-catching outerwear and jackets here.","Naomi Campbell Looks Stunning in Her Silver, Shiny Trench Coat",0
3494,188658671886044715,"You can never have too much denim in your life. This classic material comes in so many different styles and shapes, we want them all. Add more denim to your closets as we fully embrace the fall from designers like Isabel Marant, Agolde, R13, Mother, and more.",Embrace the Casual Side of Your Closet with Denim of every Style,1
3495,188658671886042262,"Great minds think alike. @peruconnection cofounder Annie Hurlbut Zander collaborated with iconic former Harper’s BAZAAR Editor-in-Chief Glenda Bailey for an exciting new collection you’ll want to wear immediately. Revitalizing the brand’s signature aesthetics, each Andean artisan-crafted piece is an incredible must-have. We talked to the two leading ladies about the label’s rich history, inspiration behind the capsule, sustainability, and more.",This Artisan-Crafted Collection is a Must-Have for Your Winter Wardrobe,4
3496,188658671886041570,"Make your statement this season with a timeless coat that you can wear year after year. Think of it as an investment, and find yourself a piece that you don't want to take off even after you enter the warm building.",Shop These Coats and Jackets to Prepare for the Cold Season Ahead,2
3497,188658671886041006,"Re-boot your shoe collection with the best picks of the season. From cult-favorite Western styles and night out stunners to coveted knee-highs and statement-making prints, these boots are the only ones you need.",Boot Up With These Fall-Ready Shoes,6
3498,188658671886037992,Emma Chamberlain in this monochromatic ensemble looks like a high-fashion dream. We love a dark outfit for fall!,Emma Chamberlain Looks Gorgeous and Elegant in This Monochromatic Look,5
3499,188658671886037167,"Ana de Armas looks so chic in this all-black look, the perfect combination of preppiness and elegant for autumn.",Ana de Armas Rocks Her All-Black Look,13
3500,188658671886036687,"Preppy, oversized, endlessly chic—this is a perfect example of why we're in love with fall fashion. Shop giant blazers and preppy jackets here, featuring designers like Marni, The Row, Prada, and more.",Oversized Blazers to Keep You Warm and Stylish for Autumn,3
3501,188658671886033404,"Get your greens in and find yourself a colorful dress for your autumn events. No matter where you're going, you're sure to keep everyone's attention.",Shop Must-Have Dresses on ShopBAZAAR,3
3516,91620173664363683,"Indulge in a culinary journey as we present these delectable wedding food ideas that will leave your guests craving for more! From elegant canapés to stunning dessert displays, we've got the perfect recipes to make your special day truly unforgettable. Find more mouthwatering inspiration through the link in our bio!",Classic Elegance With Soft And Sweet Dusty Blue Details,2
3517,91620173664363682,Dress to impress and leave an everlasting impression! Unleash your inner fashionista and make heads turn at your friend's special day. Discover all the style inspiration you need to be the best-dressed guest on our Wedding Guests board.,Classic Elegance With Soft And Sweet Dusty Blue Details,0
3518,91620173664363681,✨ Transform your wedding dreams into reality with this breathtaking white floral arch 💐💍 Capture the essence of romance and elegance on your special day. Tap the image to discover our top tips and tricks for creating the perfect floral arch and make your wedding extraordinary! 🌸🎉,Classic Elegance With Soft And Sweet Dusty Blue Details,0
3526,91620173664363597,"Looking to add a refreshing twist to your special day? Say ""cheers"" to an Aperol Spritz wedding! This vibrant and citrusy cocktail will bring a burst of flavor to your celebration, while creating a stylish and trendy atmosphere. Click the link in our bio for more wedding inspiration! 🥂✨ #AperolSpritzWedding #CheersToLove",Classic Elegance With Soft And Sweet Dusty Blue Details,1
3556,21181060739463259, ,Discover The Spectre™ Range,5
3559,21181060739442420,From @jonathanadler,Channeled Velvet Floor Pillow,10
3563,21181060739418791,From @jonathanadler,Double Tube Vase,13
3564,21181060739418788,by @jonathanadler,Globo Bookends,20
3569,21181060739378684,From The GREAT + Eddie Bauer,The Hiking Jacket,12
3629,21181060739374300, ,Poppy and Pout - Blood Orange Mint,3
3631,21181060739370700, ,Pin on Eclectic decor,10
3633,21181060739370693, ,Ivurie Haus | Brand Design,11
3634,21181060739370624,"Boxes, gradient by Jon Noorlander",Jon Noorlander Boxes,8
3638,21181060739370619,Kelli Laderer Prioritize Reasons To Smile Gif Animation Prioritize Reasons To Smile Gif Animation,Prioritize reasons to smile gif ,59
3639,21181060739370606,"The hanging mobile Fringe in rose looks perfect in a modern nursery, but can also work well anywhere in your house giving an extra point of light to any room. Like all my jewels this piece is handmade with brass and recycled paper. Layers of book pages are impregnated with thermosetting eco resin and topped with a decorative paper layer. After this has been compressed and cured, it make a hard and durable surface very similar from wood, then I can cut, drill and sand the colored shapes. The mix",Kinetic mobile- Hanging mobile- Brass mobile- Home decor- Recycled paper- Modern nursery- Fringe in pink,3
3648,21181060739370559,from @keds1916,Tiasa Sneakers,8
3649,21181060739370555,From The Great + Eddie Bauer,The Daylight Sandal,7
3650,21181060739370547,From @anthropologie,Pilcro Comeback Boyfriend Denim Jacket,5
3651,21181060739370540,"From @anthropologie Our beloved Fern Storage Cabinet is now available as wall-mounted storage for your bathroom, bedroom, bar — or anywhere! With tempered glass doors, buttoned-up brass hardware, and natural ash wood interior, this piece lends charm to safekeeping your array of toiletries, beauty essentials, or ingredients for a signature cocktail.",Fern Wall Storage Cabinet,27
3726,21181060739370533,From @anthropologie This multicolor floor covering lends an eye-catching element to any space.,Handwoven Celma Indoor/Outdoor Rug,20
3727,21181060739370524,"From @anthropologie Featuring a rotund silhouette rendered in luxe Valencia linen, this accent chair as welcoming to your eyes as it is as a cozy seat.",Valencia Linen Mermont Chair,25
3728,21181060739370520,From @anthropologie White stoneare,Lanie Garden Pot,7
3729,21181060739370501,"From @anthropologie With a sculptural base and elegant floral-accented glass tabletop, this side table is ready to carry candles and cocktails - and make a statement in your interior.",Mira Bird Side Table,8
3736,21181060739365237, ,BESTIES save these cute wallpapers to your phone,3
3748,21181060739361028, ,5 July 2020 Nail Art Designs For Brighter Days & At-Home Manicures Ahead,10
3751,188658671886032624,Sophie Turner looks like a fall dream in her oversized blazer and leather trousers—we can't get enough!,Sophie Turner is Stunning in This Fall Outfit,2
3752,188658671886029822,These are not the festive holiday sweaters you saw growing up—these stylish knits know how to have a good time and will take you from cozy days to party nights.,Not Your Grandmother's Sweaters,1
3753,188658671886029090,"Even if you're out past midnight on Halloween, you'll still resemble royalty with this elegant Cinderella look. The perfect fit, your glass slippers and beautiful blue gown will make the night one to remember—just make sure your ride hasn't turned into a pumpkin before you're ready to leave.",Channel Your Inner Royal with This Cinderella-Inspired Costume,7
3754,188658671886028032,"When you have an amazing wardrobe of “going out” essentials, evening get-togethers are infinitely more exciting. Play dress up in the best and brightest pieces, all hand-selected by our editors.",Your New Going-Out Attire is Here,9
3755,188658671886024828,"Find the Gomez to your Morticia 🖤🦇 Halloween is coming up fast, and if you love a spooky and mysterious vibe over pretty and sweet for your costume, the glamorous and elegant matriarch of the Addams Family is the way to go.",The Creepiest and Most Glam Costume for Halloween,3
3756,188658671886023908,"You don’t need an excuse to treat yourself to a piece of jewelry. Shop otherworldly necklaces, nostalgia-inspiring rings, and more magical finds.",Must-Have Jewelry to Add More Color to Your Fall Looks,3
3757,188658671886023572,"Just like your style, your home should get a seasonal update. Set the fall tone with tablescapes featuring gorgeous jewel tones, prints on prints, and luxe vibes that still exude a cozy feel.",Colorful Home Decor for Fall,7
3758,188658671886020323,Going for something more avant-garde? Shop our new arrivals for something that stands out and packs a punch.,Our New Arrivals Will Transform your Fall Outfits,9
3759,188658671886019682,"""House of the Dragon"" star Milly Alcock takes her rightful place on the Iron Throne as a street style queen during Paris Fashion Week.",Milly Alcock Sports Baggy Everything While in Paris for Fashion Week,4
3760,188658671886019041,"Our Friday evening mood. 💎✨ Live out your Old Hollywood glam fantasies with our curated jewelry edit of gold pendants, sapphire rings, pearl earrings, diamond bracelets, and more stunning pieces here.",Luxurious Jewelry for a Stunning Fall,10
3761,188658671886015826,"Kick back with our newest edit of sneakers featuring coveted styles that are so comfortable and chic with a hint of glam, you won't ever want to put on another pair of heels again.",Sneakers Made for Walking,4
3762,188658671886015021,"Nostalgic and all-around classic, the denim skirt can easily replace your go-to skinnies for a playfully sophisticated update.",'90s Denim for Modern Fashion,3
3763,188658671886014479,Don't know what to wear? No problem—scroll through our edit of designer clothing and you're sure to find outfit inspiration. These luxe picks will have you endlessly adding to your cart.,Must-Have Clothing Featuring Designers You Adore,3
3764,188658671886011139,"Find all the designer and luxurious pieces you need to upgrade your fall wardrobe in our edit of new arrivals. Shop Miu Miu, Ganni, Jacquemus, and more here.",New Arrivals You Need to Check Out for a Chic Wardrobe,6
3765,188658671886010294,"Home is where the La DoubleJ tea tray for two is. ❤️ At least that's what our editors say! As we make our way through these early days of fall, our homes are in dire need of an autumnal decor upgrade. Think maximalist prints, warm candles, heavy coffee table books, colorful tapestries, and more pieces you'll treasure forever.",Decor to Make Your Home Cozy for Fall,0
3766,188658671886009831,"The baggier the better. The beloved high-rise, wide-leg jean is back with more drama, more coverage, more everything.",Baggy Denim to Bring the Drama,3
3767,188658671886006862,"Our editors can’t seem to get enough of @prada, especially the coveted label’s next-level sunglasses. Featuring a bold shape that’s rounded and voluminous in all the right places, our Hero has the power to transform your entire look. And it wouldn’t be Prada without the iconic triangle logo decorating both temples and the signature lettering front and center—ensuring you’ll look good from every angle. This is the ultimate accessory you need this fall and beyond.",You Need Our Latest Prada Hero in Every Color,3
3768,188658671886006204,We’ll take as many pockets as we can. Utilitarian details that are as functional as they are stylish are always a win.,Chic Denim on Denim Looks for Fall You Need Now,4
