,id,description,title,repin_count
2532,188658671886414717,"The most exciting fashion trend for 2023 is Moto Effect—that's right, we're taking style inspiration from the heart-racing, blood-pumping sport for this winter. Get a head start on it with leather pants you'll be able to pair with any style aesthetic.",11 Pairs of Leather Pants to Help You Dress With a Moto Aesthetic,4
2533,188658671886412913,"Lily Collins was simply lovely at the ""Emily in Paris"" season three premiere in this white mini dress decorated with silver bows. The fact that her shoes match perfectly is just the cherry on top of an already flawless look.","Lily Collins at the ""Emily in Paris"" Season Three Premiere",6
2534,188658671886412014,"There's jewelry that you put on after your outfit as the subtle finishing touches, and then there's jewelry you base your entire look around. For 2023, we're investing in the latter. Sometimes a piece is so sensational that you don't want your look to take away from its brilliance, and our editors have curated a selection of gold tennis bracelets, gemstone earrings, pearl necklaces, and more that will have you thinking exactly that. Gift yourself a glittering and divine statement piece here.",Shop Jewelry To Make Your Winter Outfits Sparkle,3
2535,188658671886411140,"Monochrome is always in—it's elevated and chic without trying too hard. A matching set will make you look put-together, whether you're out running errands or going to the office.",Shop Matching Sets & Monochromatic Outfits Here,6
2536,188658671886408899,"We're loving Hailey Bieber's LA winter style, and this chic leather trench is giving Matrix vibes that we adore.",Hailey Bieber Steps Out in a Black Leather Trench Coat,8
2537,188658671886407647,"The weather has been unpredictable, but one thing’s clear: it’s still cozy season and our Hero is the solution to the unexpected drops and rises in temperature. This boxy collared coat from buzzy brand Leset features a slightly oversized fit and dropped shoulders that’s great for layering, chic bouclé trim that adds texture and refinement, and side pockets for maximum functionality. A modern twist to classic workwear, this versatile must-have will become your go-to outerwear for years to come.",Shop This Cozy Bomber Jacket For Your Cold Weather Needs,4
2538,188658671886406867,This little white dress on Lily Collins is such a chic look. We love how the structured shoulders look with the mini skirt of the outfit.,Lily Collins Steps Out In a Little White Dress,6
2539,188658671886402813,"Holiday season may be over, but don't put those gowns and cocktail dresses away just yet. We're taking one extreme to the other this year and dressing down our eveningwear into looks we can wear on the daily. Shop our edit now to get a head start on your dressed down looks.",Wear These Gowns & Cocktail Dresses Any Day of the Week,6
2540,188658671886401932,"Your outfit isn't complete without an abundance of winter accessories. We're talking blanket scarves, chic balaclavas, cozy beanies, elbow-length gloves, and more to keep you warm as you step outside.",Shop These Winter Accessories to Stay Warm in the Cold,9
2541,188658671886399409,"Kendall Jenner is sporty and chic seen here in Los Angeles. While it's a simple look, the effortlessness she carries herself with is so enviable.",Kendall Jenner Spotted in Los Angeles Looking Effortlessly Sporty,7
2542,188658671886398087,"The bomber jacket is back, and if you don't believe us, at least believe Hailey Bieber. This ultra-puffy piece is going on our winter vision boards.",Hailey Bieber is Bringing Back the Bomber Jacket,6
2543,188658671886397124,"Keep the neutrals in 2022—we're all about bright colors and vivid pieces for the new year! Find a coat that will make you pop against the crowd here from brands Jacquemus, Christopher John Rogers, Dorothee Schumacher, Blumarine, and more.",You Need to Shop These Winter Brights,5
2544,188658671886392664,"Your new year wardrobe should reflect your new year's style resolutions. Try something more minimalist, try something more maximalist, elevate your staples, embrace more trends—whatever you're wanting to do with your fashion, start at our new arrivals to find what you need.",Shop Stylish New Arrivals for a Chic New Year,1
2545,188658671886391808,"It's your season and you'll party if you want to, Capricorn! We're not just saying this because it's your birthday—when the sun moved into your sign on December 21, it brought with it a huge burst of energy to prepare you for the ups and downs ahead. Read more about your Capricorn horoscope here!",Shop Your Capricorn Season Gift Guide,3
2546,188658671886390781,"Lily Collins stepped out in a classic black pea coat, but let some of her ""Emily in Paris"" character shine through with a bright pop of green underneath. How does she always look so chic?",Lily Collins Bundles Up in NYC,8
2547,188658671886387510,"Deck the halls and deck out your wrists with gemstone cuffs and diamond details as you prepare for the festivities. After the season of giving, it's the perfect time to gift yourself something, too, and jewelry is always a safe bet, whether you want to seriously splurge or have tightened the purse strings. Shop stunning pieces like these bracelets from Victor Velyan and more here.",Decorate Your Winter Outfit With Pops of Jewelry,10
2548,188658671886386671,"Emma Chamberlain made an appearance at the Jacquemus show in this structured denim jacket and fringed khakis, so we went out and bought a structured denim jacket and fringed khakis.",We're Loving Emma Chamberlain's Low-Key Look at Jacquemus,5
2549,188658671886385745,"Meghann Fahy looks effortless in this all-white look, a stark contrast to the extremely colorful outfits we've seen her wear in The White Lotus. Monochromatic looks so good on her.",A Chic and Elegant White Monochromatic Look for Meghann Fahy,5
2550,188658671886382707,"Our latest jewelry edit features timeless must-haves imbued with meaning, budget-friendly finds you’ll cherish, gorgeous statement pieces that will steal the show, and more beautiful treasures you’ll want to adorn yourself with. Harper's BAZAAR, 2018 Photography by Kenneth Willardt Styling by Amanda Alagem",Start Off the New Year Decked Out in The Latest Gems,4
2551,188658671886382093,Presenting our latest roundup of the best collections and buzzy brands you need to shop now. Discover bold sequins and tailored trousers from LaQuan Smith to start a sparkly new year.,Shop Sparky Matching Sets and Colorful Knitwear,6
2552,188658671886381414,"Start the year in fresh styles and designer fashion that will last you many seasons to come. If you're looking for something cozy, discover staple knits and must-have sweaters. If you're looking for trendy, shop cargo skirts and sporty sunglasses. Whatever you want, you'll find it here.",Shop Must-Have New Arrivals for a Stylish New Year,10
2553,188658671886379177,"Aubrey Plaza is giving resortwear elegance with this light, two-piece set. Plaza's red carpet looks have been so stunning lately, we can't wait to see what she brings in for the new year.",Aubrey Plaza Is Incredibly Chic In This White & Sparkly Matching Set,4
2554,188658671886378120,"Looking for a statement skirt to complete your winter outfit? You've come to the right place. Check out our edit of designer skirts of all shapes, colors, and sizes from brands you adore.",You Need These Skirts In Your Winter Wardrobe,6
2555,188658671886377559,"""One of my New Year's Resolutions is to entertain at home more. There's nothing more special than an intimate dinner party with those closest to you, and I've been looking to upgrade my tablewear with something a bit more fun than my usual place settings. Misette has everything I need to make an Instagram-worthy tablescape: colorful glass candleholders, embroidered napkins, unique cutlery sets, floral salad plates... Hosting has never looked so good.""—Caroline Lassman, ShopBAZAAR Editor",This Brand Will Make Your House Colorful and Quaint for the New Year,3
2556,188658671886375003,"Add a touch of luxury to any look with a crystal bag from Kara. New to ShopBAZAAR and the latest editor-fave, Kara's stunning purses are anything but basic, embellishing even the simplest of outfits with the perfect amount of sparkle. Find this stunning silver and more colors here. Photography by @anniecollinge Creative Direction and Styling: @rottingdeanbazaar",Sparkling Purses and Glittering Bags from New-To-ShopBAZAAR Brand Kara,4
2561,47639708548671913, ,Grafitgrå,1
2562,47639708548671911, ,Daniela Dayrell Ribeiro on Instagram: “Cara de domingo - Rita,2
2566,47639708548669727, ,Essem Design – Nostalgi hook strip,1
2570,47639708548669131,Tall är en vacker levande grön kulör från vår färgkollektion Jordnära. Noga utvalda färger inspirerade av vår nordiska natur. Upplev Tall på marbodal.se,Utforska vår färgkollektion Jordnära,1
2585,21181060739961615, ,Flower eyeshadow,3
2587,21181060739961613, ,Nerd,5
2591,21181060739907380,from @freepeople,Hit The Slopes Printed Pullover,14
2594,21181060739907343,from Krewe,Margot Sunglasses (Caffe Dolce),7
2595,21181060739907329,from @eddiebauer x @Thisisthegreat,The Reversible Bomber Jacket,15
2596,21181060739907310,from @anthropologie,Maeve Plisse Pants,5
2597,21181060739907299,from @jcrew,Pavé Crystal Cocktail Ring,2
2603,21181060739885326, ,Billie Color Palette,18
2606,21181060739831385,from @jcrew,Woven Bucket Bag,8
2653,91620173664373934,"This style-centric vineyard wedding wowed its guests with the most stunning balance of whites and greens! From the playful parasols to the chic tablescape, see the link in our bio for more classic wedding inspo!",A Style-Centered Keswick Vineyards Wedding That Wows,0
2654,91620173664373933,"This style-centric vineyard wedding wowed its guests with the most stunning balance of whites and greens! From the playful parasols to the chic tablescape, see the link in our bio for more classic wedding inspo!",A Style-Centered Keswick Vineyards Wedding That Wows,0
2655,91620173664373932,"This style-centric vineyard wedding wowed its guests with the most stunning balance of whites and greens! From the playful parasols to the chic tablescape, see the link in our bio for more classic wedding inspo!",A Style-Centered Keswick Vineyards Wedding That Wows,2
2656,21181060739831371,from @katespadeny,All Day Sunshine Tote,4
2657,21181060739831367,from @llbean,Boat and Tote (Zip Top),4
2658,21181060739831363,from @freepeople,Hudson Sling Bag,20
2659,21181060739831361,from @loefflerrandall,Mallory Desert Sand Woven Crossbody,2
2660,21181060739831355,from @crateandkids,XO Heart-Shaped Kids Throw Pillow by Leanne Ford,20
2662,21181060739831336,from @urbanoutfitters,Ruby Striped Chair,17
2663,21181060739831331,from @urbanoutfitters,Mason Bookshelf,23
2664,21181060739831327,from @urbanoutfitters,Armand Book Shelf,36
2665,21181060739831323,from @urbanoutfitters,Sienna Checkered Bench,20
2666,21181060739831318,from @urbanoutfitters,Shea Checkered Storage Bench,3
2667,21181060739831317,on @etsy,Westwood Bricks Furniture Handle,18
2668,21181060739831313,from @nike,SuperRep Go 3 Flyknit Next Nature,6
2669,21181060739831304,from @westelm,Bole Road Patterned Oversized Lumbar Pillow Cover,13
2670,21181060739831295,by @maisonetteworld,Helen Sweater (in Dusty Pink Floral),12
2706,188658671886374136,"It's the end of the year, and we took a look back on all that's happened in the fashion world to bring to you our ShopBAZAAR Superlatives. Our Best Party Planner of 2022? La DoubleJ.",ShopBAZAAR Superlatives: 2022's Best Party Planner,1
2707,188658671886373365,"We’re kicking off 2023 with a classic must-have. This exclusive beanie from buzzy brand Meg Cohen is beautifully crafted in a pretty periwinkle cashmere that’s so soft and luxurious, you’ll want to wear it year-round. Designed with versatility in mind, you can go for a slouchy finish or fold up the brim for a more fitted look. Buy now, keep forever.",Shop The Cozy ShopBAZAAR Hero That Will Keep Your Head & Hands Cold,2
2708,188658671886370400,"It's the end of the year, and we took a look back on all that's happened in the fashion world to bring to you our ShopBAZAAR Superlatives. Our Best Dressed from 2022? Style icon Anne Hathaway.",ShopBAZAAR Superlatives: 2022's Best Dressed,3
2709,188658671886369653,"HAPPY NEW YEAR! Here's to another year of stunning styles and unforgettable fashion. The ShopBAZAAR family wishes you good luck as we enter 2023—we can't believe it's already January again! If you're in the mood to celebrate and gift yourself a little something to start the year off right, click here for our gorgeous new arrivals. ✨",Shop Designer New Arrivals for a Wonderful New Year,0
2710,188658671886367668,"If you're the ""life of the party"" of your friend group, let us introduce you to No Pise La Grama. This Venezuelan-based brand specializes in vibrant colors and patterned pieces decorated with fringe, sequins, feathers, and more playful details so your look can reflect your spirited persona. This new year is all about going glam—get a head start here.",No Pise La Grama Is The Party Brand You Need to Know Now,11
2711,188658671886366912,"It's the end of the year, and we took a look back on all that's happened in the fashion world to bring to you our ShopBAZAAR Superlatives. What do we think is the Most Likely to Succeed in 2023? All Things Blue. 💙",ShopBAZAAR Superlatives: Most Likely to Succeed in 2023,2
2712,188658671886366039,"It's the end of the year, and we took a look back on all that's happened in the fashion world to bring to you our ShopBAZAAR Superlatives. Our Most Talked About of 2022? Julia Fox. 🦊",Shop BAZAAR Superlatives: 2022's Most Talked About,1
2713,188658671886364326,"Presenting our latest roundup of the best collections and buzzy brands you need to shop now: artisanally crocheted pieces from Diotima, exuberant knits and dresses, and bold sequins and tailored trousers.",Diotima Is the Fresh Face Crocheted Fashion Needed,8
2714,188658671886363337,"It's the end of the year, and we took a look back on all that's happened in the fashion world to bring to you our ShopBAZAAR Superlatives. Our Most Dynamic Brand of 2022? Diesel.",ShopBAZAAR Superlatives: 2022's Most Dynamic Brand,2
2715,188658671886362445,"It's the end of the year, and we took a look back on all that's happened in the fashion world to bring to you our ShopBAZAAR Superlatives. Our 2022 Most Popular? Barbiecore pink, duh!",ShopBAZAAR Superlatives: Most Popular of 2022,3
2716,188658671886360628,"Add a pop of color to your look with a vivid coat or statement jacket before you step out. All eyes will be on you, and you'll be a bright spot in these grey days.",Shop Statement Coats and Colorful Jackets for Winter,11
2717,188658671886359583,"It's the end of the year, and we took a look back on all that's happened in the fashion world to bring to you our ShopBAZAAR Superlatives. Our Life of the Party from 2022? Rachel Gilbert's designs.",ShopBAZAAR Superlatives: 2022's Life of the Party,1
2718,188658671886359054,"It's the end of the year, and we took a look back on all that's happened in the fashion world to bring to you our ShopBAZAAR Superlatives. Our Most Charming Couple of 2022? George and Amal Clooney.❤️",ShopBAZAAR Superlatives: Most Charming Couple of 2022,2
2719,188658671886357060,"Take your tops to the next level by layering unexpected pieces together. Not only will this create a more interesting look, but it will help keep you warm in the winter months. Click here for more winter outfit inspo surrounding your tops, sweaters, crops, and more.",Check Out These Designer Tops For Layering Inspiration,10
2720,188658671886356155,"It's the end of the year, and we took a look back on all that's happened in the fashion world to bring to you our ShopBAZAAR Superlatives. Our Most Unforgettable Moment from 2022? Coperni's Spring/Summer 2023 show featuring Bella Hadid.",ShopBAZAAR Superlatives: Most Unforgettable from 2022,2
2721,188658671886355156,"It's the end of the year, and we took a look back on all that's happened in the fashion world to bring to you our ShopBAZAAR Superlatives. Our 2022 It Girl of the Moment? None other than Miss Jenna Ortega.",ShopBAZAAR Superlatives: It Girl of the Moment for 2022,3
2722,188658671886352892,"Introducing Pantone’s 2023 Color of the Year: Viva Magenta. Brave, fearless, and empowering, this vibrant hue promotes joy and optimism, encouraging you to write a new narrative and experiment with self-expression without restraint. Shop beaded bags, flowing midi skirts, embellished slingbacks, cozy pullovers, and so much more.",Shop Pantone's Color of the Year: Viva Magenta,3
2723,188658671886352016,"A statement jacket is your winter best friend. Grow your friend group with puffers, trench coats, cropped blazers, and colorful picks so you'll never have a dull winter look.",Shop These Winter Coats To Stay Stylish This Season,11
2724,188658671886351375,Social media influencer Tefi looks relaxed and oh-so-chic in this green ensemble at the Jacquemus show from December. This color on her is a vision—obsessed would be an understatement.,TikTok Star Tefi is Making Us Green with Envy in this Sage Look,2
2725,188658671886348964,"Aubrey Plaza looks so stunning in this little blue cocktail dress on Late Night with Seth Meyers. Dark colors always pair well with the actress, and we love the added shine from the sequins.",Aubrey Plaza is Reminiscent of the Night Sky in This Dark Blue Sequin Dress,3
2726,188658671886348104,"Whether you're searching for a puffer, a trench, a blazer, or something in between, you'll find your perfect outerwear match in our edit. Specially curated with luxury in mind, our editors have found the coats that will not only keep you extremely warm but looking extremely chic.",Shop Coats As Stylish As They Are Toasty,1
2727,188658671886347247,"Our love for all things crochet will continue straight into 2023 with our Hero from Marvin Ruby leading the way. These cute bags are the perfect, functional size for running errands, brunch dates, and going from day-to-night. Each piece takes 13 hours to craft and are handmade by artisans in Peru with 100% Andean Highland wool, so it’s super soft yet sturdy. And if you’re looking for better-late-than-never gift, this is a delightful option.",This Crocheted Bucket Bag is ShopBAZAAR's Weekly Hero,2
2728,188658671886345025,"Meghann Fahy appears chic as can be in this denim number. BRB, adding more denim to our carts as we type.",Do Denim Like Meghann Fahy,4
2729,188658671886344478,"Happy holidays from the ShopBAZAAR family! Wishing you and your loved ones a wonderful and joyous time—and here's to crossing off all of the items on our wish lists! Harper's BAZAAR, 1943",Happy Holidays From ShopBAZAAR!,4
2730,188658671886342879,Kate Hudson is bundled up in her sherpa coat to brace for the cold. We love the glimpse of red we get from under her jacket.,Kate Hudson Is Our Winter Outfit Goals,7
2731,188658671886342044,Sarah Jessica Parker looks breezy and fabulous in this minimally colored dress. We love how she paired the yellow heels to bring out the yellow in her look.,Sarah Jessica Parker Looks Like a Hamptons Mom in This Chic Dress,25
2732,188658671886341530,"Your holiday look should be unforgettable—with our edit of festive party attire, it will be. From statement gowns to elegant heels to luxury lipsticks to embellished bags, your choices are endless when it comes to planning out an enviable outfit. And when you find that piece that's so perfectly you, you'll look and feel like you're walking on a red carpet. Harper's BAZAAR, 1992",The Best Kind of Holiday Dressing,12
2733,188658671886339660,Zoey Deutch looks like the embodiment of summer in this bright blue dress she wore out.,Zoey Deutch Looks Stunning in This Blue Dress,10
2734,188658671886338844,"Our favorite American-turned-Parisian is back just in time for the holidays, and her style is as colorful and playful as ever. ""Emily in Paris"" has already been binged, and our favorite looks have already been picked out—this yellow one being high on our editors' lists. Shop her look, and check out our new arrivals to prepare yourself for a fashionable New Year.",Here's How to Dress Like Emily In Paris,4
2735,188658671886338224,"Step into the spotlight and kick off 2023 with the dress of your dreams. Don’t know where to start? Go for gorgeous emerald greens that make an impact and stir envy. In our party dressing edit: this stunning cut out dress from Paco Rabanne , sparkling, rose gold matching sets, mesh tops, faux fur coats, hot pink mules, and so much more.",Shop Elegant Gowns and Chic Cocktail Dresses Everyone Will Fall In Love With,9
2736,188658671886335034,"Who says holiday dressing has to involve a dress? A statement trouser can be the start of the perfect festive 'fit, like this feather-trimmed pair from Lapointe. Wear them with a simple top to keep them the center of attention or really make an impact as you enter the party with the matching blouse (which you can find here 😉).",Shop Lapointe For All Of Your Winter Outfit Inspo,2
2737,188658671886334293,"Presenting our latest roundup of the best collections and buzzy brands you need to shop now: colorful pieces and a playful aesthetic from Kitri, relaxed shapes and eclectic designs from Maria Cher, and artful and one-of-a-kind matching sets from Rianna + Nina.",Designers We Love To Upgrade Your Winter Outfits,3
2738,188658671886333608,"You don't have to give up feeling cozy for looking chic this holiday season—festive sweaters and elegant knitwear are the best plus ones to your upcoming soirées and family get-togethers. A simple striped number like this one from Paco Rabanne can be elevated to the nines with the right bottoms and accessories, all while keeping you warm and toasty on your commute back home. Find versatile knits you'll want to bring with you into the new year from our luxurious edit.",Find Chic And Elegant Sweaters For The Holidays,6
2739,188658671886331582,"Welcome to The White Lotus! If you've been as obsessed with this show as we have, then you know each character's style says a lot about their personalities: Daphne is the Hamptons mom who appears ditsy but is calculated and observant underneath her facade. Her choice in vacation attire reflects these characteristics with breezy, bright looks. Shop more White Lotus inspired resortwear here.",How To Dress Like Daphne From The White Lotus,6
2740,188658671886330732,"Welcome to The White Lotus! If you've been as obsessed with this show as we have, then you know each character's style says a lot about their personalities: Portia is the recent grad still trying to find herself. Her choice in vacation attire reflects these characteristics with her chaotic ensembles. We can't deny that her looks weren't iconic—personal thoughts on Portia's outfits aside. Shop more White Lotus inspired resortwear here.",Shop A Portia Inspired Look From The White Lotus,2
2741,188658671886330168,"Welcome to The White Lotus! If you've been as obsessed with this show as we have, then you know each character's style says a lot about their personalities: Tanya is the born-wealthy romantic who heavily cares about appearances. Her choice in vacation attire reflects these characteristics with flamboyant designer pieces. Shop more White Lotus inspired resortwear here.",Shop Tanya's Look From The White Lotus,2
2742,188658671886327901,"Stride into the new year with classic boots you can wear for many years to come. We love a good knee-high, and they're the perfect winter shoe to keep your calves warm without taking away from your personal style. Shop Stella McCartney, Khaite, Marion Parke, Labucq, and more shoe brands here.",Take A Walk In The Chicest Boots for Winter,8
2743,188658671886327270,"The cold weather is inevitable for some of us, so we may as well embrace it and start layering to the extreme. Do so in style with our latest arrivals to prepare you for winter: striped sweaters, fur-lined hats, knit scarves, puffer boots, and more.",You Need Our New Arrivals to Layer in Style,5
2744,188658671886326709,"Lily Collins looks as chic as ever in this long, black overcoat layered over her mini dress and tights. We love a mini for winter, and she is scratching that certain style itch in our brains with this neutral outfit.",Lily Collins Is Chic As Can Be In This Winter Outfit,10
2745,188658671886324913,"Jacquemus is the reigning hero of uniquely shaped bags—and they surely make amazing gifts, don't you think? Shop Jacquemus blazers, dresses, purses, trousers, and more here.",Shop Jacquemus Must-Haves,8
2746,188658671886324112,Emily Ratajkowski looks absolutely gorgeous in this ombré dress and her tie-up gold heels. We're loving this evening outfit.,EmRata Looks Stunning In This Evening Look,2
2747,188658671886320657,"As we wrap up 2022 and plan for 2023, we’re taking cues from our December/January cover and embracing the classics with a modern touch. Clean lines, minimal details, neutral colorways—shop timeless essentials here. Harper's BAZAAR, 2022/2023 Photography by Pieter Hugo Styling by Tony Irvine",THE DECEMBER/JANUARY HARPER'S BAZAAR ISSUE,4
2748,188658671886317797,"With coveted designer Johanna Ortiz, this winter will transform into an endless summer. Instantly refresh your style with wanderlust vibes, attention-grabbing prints, flattering silhouettes, vacation-ready accessories, and breezy fabrics.","Shop Resortwear Icon, Johanna Ortiz, For Your Winter Vacation Needs",2
2749,188658671886317083,"Shop winter-ready dresses so chic that you won't care about the cold. Discover adorable minis from Self Portrait, resortwear midis from Zimmermann, florals from Ulla Johnson, and so much more.",Discover Chic Winter Dresses That'll Make You Forget About the Cold,0
